lineup,mp,diff_pts,diff_fg,diff_fga,diff_fg_pct,diff_fg3,diff_fg3a,diff_fg3_pct,diff_efg_pct,diff_ft,diff_fta,diff_ft_pct,diff_orb,diff_orb_pct,diff_drb,diff_drb_pct,diff_trb,diff_trb_pct,diff_ast,diff_stl,diff_blk,diff_tov,diff_pf,player_ids,number_players,year,team
K. Clark | V. Lenard | G. McCloud | A. McDyess | R. Pack DEN 2001,44.233333333333334,7.8,2.2,-9.3,0.078,-2.4,0.8,-0.256,0.067,5.8,3.4,0.102,2.0,7.1,6.6,7.1,3.9,9.9,1.4,-3.0,1.3,6.1,2.8,"clarkke01, lenarvo01, mccloge01, mcdyean01, packro01",5,2001,DEN
R. LaFrentz | V. Lenard | R. Pack | J. Posey | K. Willis DEN 2001,42.78333333333333,-3.4,-4.1,1.0,-0.053,4.7,4.7,0.26,-0.027000000000000003,0.2,-1.0,0.062,-4.6,-14.2,-10.8,-14.2,-7.5,-19.4,-1.9,9.2,-1.2,-9.1,2.9,"lafrera01, lenarvo01, packro01, poseyja01, willike02",5,2001,DEN
R. LaFrentz | V. Lenard | J. Posey | N. Van Exel | K. Willis DEN 2001,40.1,5.2,6.2,-0.2,0.065,0.3,-6.1,0.192,0.067,-7.5,-12.7,0.153,-0.5,3.3,7.5,3.3,4.1,7.5,-4.4,-0.1,1.1,3.6,6.2,"lafrera01, lenarvo01, poseyja01, vanexni01, willike02",5,2001,DEN
K. Clark | R. LaFrentz | V. Lenard | G. McCloud | N. Van Exel DEN 2001,37.68333333333333,-13.5,-7.5,-11.5,-0.028999999999999998,1.2,11.9,-0.095,-0.019,0.4,3.0,-0.067,-8.1,-9.3,0.0,-9.3,-4.3,-8.1,-8.3,1.7,1.8,2.4,-1.4,"clarkke01, lafrera01, lenarvo01, mccloge01, vanexni01",5,2001,DEN
R. Bowen | R. LaFrentz | V. Lenard | A. McDyess | N. Van Exel DEN 2001,36.61666666666667,-30.8,-23.1,-23.1,-0.159,-3.1,4.6,-0.24600000000000002,-0.17,18.5,21.5,0.251,-9.2,-16.7,-9.2,-16.7,-9.2,-16.7,-15.4,0.0,3.1,3.1,-6.9,"bowenry01, lafrera01, lenarvo01, mcdyean01, vanexni01",5,2001,DEN
R. LaFrentz | A. McDyess | R. Pack | J. Posey | N. Van Exel DEN 2001,36.45,31.3,20.6,-6.0,0.244,0.0,1.8,-0.024,0.244,-9.8,-11.1,-0.11699999999999999,-14.2,-11.8,12.4,-11.8,-0.7,-1.6,3.8,2.7,11.5,-4.0,2.9,"lafrera01, mcdyean01, packro01, poseyja01, vanexni01",5,2001,DEN
V. Lenard | G. McCloud | A. McDyess | M. Strickland | N. Van Exel DEN 2001,34.983333333333334,19.5,6.0,-0.4,0.071,5.0,10.1,0.054000000000000006,0.1,2.4,2.7,0.013000000000000001,-1.3,0.7,5.3,0.7,2.4,5.5,10.4,-0.2,3.1,-1.3,-3.2,"lenarvo01, mccloge01, mcdyean01, stricma01, vanexni01",5,2001,DEN
T. Abdul-Wahad | K. Clark | R. LaFrentz | J. Posey | N. Van Exel DEN 2001,33.833333333333336,29.7,16.3,18.6,0.10800000000000001,1.7,3.4,0.033,0.111,-4.5,-7.5,0.068,-6.1,-17.8,-9.9,-17.8,-7.9,-19.2,11.5,10.8,-6.4,-20.1,0.8,"abdulta01, clarkke01, lafrera01, poseyja01, vanexni01",5,2001,DEN
R. Bowen | G. McCloud | A. McDyess | N. Van Exel | K. Willis DEN 2001,31.116666666666667,-27.4,-19.5,-20.3,-0.11699999999999999,-3.5,-10.5,-0.05,-0.132,15.1,21.8,-0.107,4.9,13.8,9.1,13.8,6.8,15.4,-14.2,-8.4,8.7,10.0,-10.3,"bowenry01, mccloge01, mcdyean01, vanexni01, willike02",5,2001,DEN
G. McCloud | A. McDyess | J. Posey | N. Van Exel | K. Willis DEN 2001,30.533333333333335,-22.0,1.7,11.9,-0.044000000000000004,5.1,13.6,0.063,-0.017,-30.5,-37.3,-0.233,-3.4,-9.0,-5.1,-9.0,-4.2,-10.2,8.5,1.7,5.1,1.7,7.6,"mccloge01, mcdyean01, poseyja01, vanexni01, willike02",5,2001,DEN
T. Abdul-Wahad | K. Clark | R. LaFrentz | G. McCloud | R. Pack DEN 2001,29.966666666666665,-47.9,-17.4,6.4,-0.231,-1.7,-10.3,-0.14300000000000002,-0.242,-11.4,-7.6,-0.239,13.3,8.6,-14.1,8.6,0.0,0.0,-13.0,-7.6,-9.2,9.8,0.9,"abdulta01, clarkke01, lafrera01, mccloge01, packro01",5,2001,DEN
R. Bowen | R. LaFrentz | V. Lenard | J. Posey | N. Van Exel DEN 2002,97.75,32.4,9.6,14.0,0.04,6.8,11.1,0.13,0.073,6.4,1.2,0.23199999999999998,2.1,5.1,2.4,5.1,2.3,5.4,4.3,6.7,1.5,-10.4,-2.1,"bowenry01, lafrera01, lenarvo01, poseyja01, vanexni01",5,2002,DEN
R. Bowen | A. Johnson | R. LaFrentz | J. Posey | N. Van Exel DEN 2002,78.83333333333333,-14.4,-2.6,3.6,-0.043,-1.4,-0.6,-0.062,-0.052000000000000005,-7.8,-8.5,-0.083,0.8,-2.3,-6.0,-2.3,-2.5,-5.0,-7.0,-4.4,-0.8,3.7,3.2,"bowenry01, johnsav01, lafrera01, poseyja01, vanexni01",5,2002,DEN
R. Bowen | C. Cheaney | J. Howard | G. McCloud | J. Posey DEN 2002,76.93333333333334,3.4,3.6,3.9,0.02,-1.3,-2.6,-0.028999999999999998,0.011000000000000001,-2.6,-3.2,-0.001,1.4,3.2,1.1,3.2,1.3,3.2,2.2,-0.1,0.0,-1.9,1.7,"bowenry01, cheanca01, howarju01, mccloge01, poseyja01",5,2002,DEN
C. Cheaney | Z. Hamilton | R. LaFrentz | J. Posey | N. Van Exel DEN 2002,75.93333333333334,-28.8,-9.4,-2.3,-0.087,0.2,0.4,0.0,-0.085,-10.3,-10.2,-0.133,2.6,2.6,-1.6,2.6,0.7,1.5,-10.5,-8.7,-5.9,10.4,5.0,"cheanca01, hamilze01, lafrera01, poseyja01, vanexni01",5,2002,DEN
C. Cheaney | Z. Hamilton | A. Johnson | R. LaFrentz | J. Posey DEN 2002,71.96666666666667,-21.4,-11.5,3.8,-0.132,3.1,9.9,-0.057,-0.11800000000000001,-1.5,-3.1,0.026000000000000002,-2.3,-9.1,-9.2,-9.1,-5.7,-11.8,-14.5,-2.3,0.8,3.8,0.0,"cheanca01, hamilze01, johnsav01, lafrera01, poseyja01",5,2002,DEN
A. Johnson | R. LaFrentz | G. McCloud | J. Posey | N. Van Exel DEN 2002,71.06666666666666,-16.9,-2.6,2.3,-0.04,1.7,10.8,-0.075,-0.032,-13.4,-14.6,-0.062,2.8,1.3,-4.5,1.3,-1.5,-3.2,-3.8,-3.3,2.7,7.3,4.4,"johnsav01, lafrera01, mccloge01, poseyja01, vanexni01",5,2002,DEN
T. Abdul-Wahad | R. LaFrentz | J. Posey | N. Van Exel | S. Williams DEN 2002,70.46666666666667,-5.0,3.1,8.7,-0.01,-4.2,-6.1,-0.07400000000000001,-0.036000000000000004,-7.0,-11.2,0.027000000000000003,-0.3,-2.7,-4.4,-2.7,-1.9,-3.8,-1.9,1.2,0.5,-5.5,3.4,"abdulta01, lafrera01, poseyja01, vanexni01, willisc01",5,2002,DEN
T. Abdul-Wahad | R. LaFrentz | G. McCloud | J. Posey | N. Van Exel DEN 2002,65.78333333333333,-12.2,-11.0,2.5,-0.122,3.1,10.9,0.009000000000000001,-0.107,6.8,4.8,0.134,6.7,4.3,-5.4,4.3,0.4,0.9,-6.2,-3.1,-4.8,3.7,0.8,"abdulta01, lafrera01, mccloge01, poseyja01, vanexni01",5,2002,DEN
R. LaFrentz | V. Lenard | J. Posey | N. Van Exel | S. Williams DEN 2002,65.35,-29.9,-13.7,-4.9,-0.11800000000000001,3.5,5.6,0.084,-0.099,-6.0,-5.9,-0.07,-4.2,-15.7,-16.9,-15.7,-10.1,-19.4,-11.1,-4.4,2.2,2.1,1.6,"lafrera01, lenarvo01, poseyja01, vanexni01, willisc01",5,2002,DEN
R. LaFrentz | V. Lenard | J. Posey | S. Scott | N. Van Exel DEN 2002,61.13333333333333,1.6,1.8,7.7,-0.013999999999999999,9.3,13.4,0.298,0.03,-11.3,-12.2,-0.096,4.8,3.8,-2.8,3.8,0.9,1.6,9.7,-0.7,-2.4,3.2,4.3,"lafrera01, lenarvo01, poseyja01, scottsh01, vanexni01",5,2002,DEN
C. Cheaney | T. Hardaway | J. Howard | V. Lenard | A. McDyess DEN 2002,61.1,-39.4,-17.9,-15.6,-0.11199999999999999,-7.1,-10.7,-0.156,-0.14400000000000002,3.4,7.7,-0.14800000000000002,-1.8,-6.3,-5.8,-6.3,-3.9,-9.3,-11.7,-9.5,-7.8,9.5,-2.2,"cheanca01, hardati01, howarju01, lenarvo01, mcdyean01",5,2002,DEN
R. Bowen | C. Cheaney | R. LaFrentz | J. Posey | N. Van Exel DEN 2002,59.61666666666667,-16.6,-3.9,1.0,-0.05,1.1,1.0,0.043,-0.044000000000000004,-10.0,-10.6,-0.09,-5.4,-13.4,-6.6,-13.4,-5.4,-12.9,7.1,5.3,-2.7,-4.2,3.3,"bowenry01, cheanca01, lafrera01, poseyja01, vanexni01",5,2002,DEN
R. LaFrentz | G. McCloud | J. Posey | N. Van Exel | S. Williams DEN 2002,49.983333333333334,-9.6,-3.0,21.2,-0.134,0.2,10.1,-0.237,-0.14,-3.8,-7.9,0.10400000000000001,6.8,8.2,-4.3,8.2,1.6,3.4,-10.9,2.9,-6.7,-0.5,0.0,"lafrera01, mccloge01, poseyja01, vanexni01, willisc01",5,2002,DEN
T. Abdul-Wahad | R. Bowen | R. LaFrentz | J. Posey | N. Van Exel DEN 2002,39.71666666666667,23.7,6.4,11.6,0.011000000000000001,1.5,-2.3,0.16699999999999998,0.015,9.5,17.5,-0.33299999999999996,6.9,8.2,-4.8,8.2,1.3,2.9,-1.9,3.6,-5.4,-10.0,-5.3,"abdulta01, bowenry01, lafrera01, poseyja01, vanexni01",5,2002,DEN
C. Cheaney | T. Hardaway | J. Howard | J. Posey | S. Williams DEN 2002,35.46666666666667,-22.9,-4.5,5.4,-0.079,-1.2,3.3,-0.192,-0.08800000000000001,-12.7,-14.0,-0.6920000000000001,-2.6,-8.2,-8.2,-8.2,-5.0,-11.1,3.7,-3.1,2.7,0.4,1.4,"cheanca01, hardati01, howarju01, poseyja01, willisc01",5,2002,DEN
C. Cheaney | T. Hardaway | J. Howard | G. McCloud | A. McDyess DEN 2002,33.916666666666664,-30.6,-9.2,-5.8,-0.073,-6.9,-5.3,-0.261,-0.111,-5.3,-8.1,0.111,-2.7,-5.6,-0.4,-5.6,-1.4,-3.8,-9.4,-7.2,2.8,8.7,1.4,"cheanca01, hardati01, howarju01, mccloge01, mcdyean01",5,2002,DEN
R. Bowen | A. Johnson | R. LaFrentz | V. Lenard | J. Posey DEN 2002,31.866666666666667,29.8,14.3,6.8,0.133,8.2,6.3,0.375,0.177,-6.9,-7.0,-0.079,-8.5,-13.7,-2.7,-13.7,-5.8,-11.5,12.9,5.1,6.7,-15.2,0.0,"bowenry01, johnsav01, lafrera01, lenarvo01, poseyja01",5,2002,DEN
R. Bowen | C. Cheaney | J. Howard | V. Lenard | G. McCloud DEN 2002,31.5,4.9,4.6,-10.1,0.11599999999999999,7.8,-2.7,0.578,0.174,-12.0,-9.1,-0.125,-4.0,-8.8,-2.8,-8.8,-4.2,-9.8,10.2,-1.1,0.2,8.8,2.5,"bowenry01, cheanca01, howarju01, lenarvo01, mccloge01",5,2002,DEN
C. Cheaney | D. Harvey | J. Howard | V. Lenard | G. McCloud DEN 2002,30.433333333333334,-3.2,2.5,5.1,0.002,8.8,5.7,0.284,0.047,-16.9,-21.9,-0.066,5.6,4.8,-2.2,4.8,1.7,3.7,-4.8,-8.8,-3.6,10.6,6.1,"cheanca01, harvedo01, howarju01, lenarvo01, mccloge01",5,2002,DEN
R. Bowen | A. Johnson | R. LaFrentz | V. Lenard | N. Van Exel DEN 2002,30.033333333333335,-7.1,-8.6,-13.7,-0.009000000000000001,4.0,0.4,0.2,0.018000000000000002,6.1,6.2,0.068,-7.5,-14.6,-0.5,-14.6,-3.9,-10.5,-10.9,-4.0,-2.1,4.1,-2.9,"bowenry01, johnsav01, lafrera01, lenarvo01, vanexni01",5,2002,DEN
J. Harrington | D. Harvey | N. Hilário | J. Howard | V. Yarbrough DEN 2003,227.56666666666666,-4.6,1.0,1.8,0.002,-4.1,-10.3,-0.073,-0.023,-2.4,2.0,-0.151,6.0,11.6,2.7,11.6,4.5,10.1,4.7,-1.8,-2.5,3.1,1.2,"harriju01, harvedo01, hilarne01, howarju01, yarbrvi01",5,2003,DEN
R. Bowen | J. Harrington | N. Hilário | J. Howard | V. Yarbrough DEN 2003,157.6,21.9,15.2,18.5,0.08,-1.3,-6.0,0.14400000000000002,0.069,-7.3,-13.9,0.09699999999999999,1.1,1.2,-1.0,1.2,0.3,0.8,11.7,6.9,0.5,-10.4,3.8,"bowenry01, harriju01, hilarne01, howarju01, yarbrvi01",5,2003,DEN
J. Harrington | N. Hilário | J. Howard | N. Tskitishvili | V. Yarbrough DEN 2003,103.53333333333333,-7.7,-0.4,-1.6,0.003,-3.6,-7.2,-0.146,-0.018000000000000002,-3.4,-0.6,-0.125,0.3,2.3,3.3,2.3,1.5,3.5,-0.1,2.3,-0.8,1.5,3.5,"harriju01, hilarne01, howarju01, tskitni01, yarbrvi01",5,2003,DEN
J. Harrington | D. Harvey | N. Hilário | J. Howard | R. White DEN 2003,91.01666666666667,-1.1,-0.4,-12.6,0.064,-5.0,-15.5,0.092,0.036000000000000004,4.6,2.0,0.094,-0.7,7.6,16.4,7.6,7.7,17.0,5.3,-5.4,-0.6,12.6,5.8,"harriju01, harvedo01, hilarne01, howarju01, whitero02",5,2003,DEN
J. Harrington | N. Hilário | J. Howard | N. Tskitishvili | R. White DEN 2003,79.25,-6.8,2.2,7.0,-0.012,0.6,-3.3,0.125,-0.01,-11.8,-6.5,-0.298,6.7,10.4,-4.5,10.4,0.7,1.7,-3.0,-1.8,-0.5,2.2,5.3,"harriju01, hilarne01, howarju01, tskitni01, whitero02",5,2003,DEN
R. Bowen | J. Harrington | N. Hilário | J. Howard | R. White DEN 2003,75.51666666666667,-14.1,-3.7,1.5,-0.053,-3.0,-7.4,-0.153,-0.071,-3.7,-1.5,-0.1,3.0,2.5,-3.0,2.5,0.0,0.0,-3.0,3.0,-5.2,3.0,2.2,"bowenry01, harriju01, hilarne01, howarju01, whitero02",5,2003,DEN
M. Blount | R. Bowen | J. Howard | J. Posey | C. Whitney DEN 2003,73.95,-13.6,-6.2,-0.6,-0.064,-0.9,3.5,-0.16699999999999998,-0.069,-0.3,-1.9,0.085,-0.4,-3.7,-4.6,-3.7,-2.6,-5.5,-1.4,1.7,0.2,2.5,0.4,"blounma01, bowenry01, howarju01, poseyja01, whitnch01",5,2003,DEN
D. Harvey | N. Hilário | J. Howard | C. Whitney | V. Yarbrough DEN 2003,58.333333333333336,-13.4,2.0,6.6,-0.016,-3.6,-2.9,-0.19699999999999998,-0.042,-13.8,-18.3,0.02,-1.9,-4.3,-1.2,-4.3,-1.8,-4.3,1.3,3.7,-0.9,-1.2,6.6,"harvedo01, hilarne01, howarju01, whitnch01, yarbrvi01",5,2003,DEN
M. Camby | N. Hilário | J. Howard | R. White | S. Williams DEN 2003,55.233333333333334,11.9,5.6,-6.9,0.10400000000000001,-0.1,-1.2,0.023,0.107,0.8,-0.2,0.048,-3.1,1.5,10.3,1.5,3.5,9.1,15.8,1.1,7.1,2.9,0.0,"cambyma01, hilarne01, howarju01, whitero02, willish01",5,2003,DEN
M. Blount | R. Bowen | J. Howard | J. Posey | K. Satterfield DEN 2003,54.916666666666664,-16.3,-2.9,15.4,-0.113,-3.8,-2.9,-0.278,-0.14,-6.7,-6.7,-0.078,10.6,13.4,-5.8,13.4,2.4,5.3,-11.5,-3.8,-2.9,-1.9,1.0,"blounma01, bowenry01, howarju01, poseyja01, satteke01",5,2003,DEN
M. Blount | R. Bowen | J. Harrington | J. Howard | J. Posey DEN 2003,43.85,-14.6,-2.4,12.7,-0.081,1.4,4.2,0.05,-0.075,-11.2,-9.7,-0.313,5.9,3.9,-5.2,3.9,0.6,1.2,-1.7,-2.9,-9.3,3.3,3.9,"blounma01, bowenry01, harriju01, howarju01, poseyja01",5,2003,DEN
R. Bowen | N. Hilário | J. Howard | J. Posey | C. Whitney DEN 2003,41.68333333333333,26.7,18.6,25.2,0.096,0.0,-9.6,0.5,0.08800000000000001,-10.6,-6.8,-0.151,9.8,21.8,5.7,21.8,7.9,19.4,6.3,12.0,-3.7,-13.1,2.4,"bowenry01, hilarne01, howarju01, poseyja01, whitnch01",5,2003,DEN
N. Hilário | J. Howard | N. Tskitishvili | R. White | S. Williams DEN 2003,40.916666666666664,-6.3,1.3,8.9,-0.031,-1.3,-8.9,0.083,-0.04,-7.6,-5.1,-0.19,6.3,8.1,-3.8,8.1,1.3,2.7,5.1,-1.3,-10.1,0.0,0.6,"hilarne01, howarju01, tskitni01, whitero02, willish01",5,2003,DEN
R. Bowen | J. Harrington | N. Hilário | J. Howard | J. Posey DEN 2003,35.766666666666666,-11.9,0.7,14.6,-0.055,-4.8,-5.0,-0.375,-0.087,-8.4,-8.7,-0.083,12.1,20.6,2.5,20.6,7.0,15.8,-8.4,3.5,-4.4,-2.3,3.1,"bowenry01, harriju01, hilarne01, howarju01, poseyja01",5,2003,DEN
D. Harvey | N. Hilário | J. Howard | R. White | S. Williams DEN 2003,34.833333333333336,-24.6,4.7,-13.1,0.122,-6.1,-12.4,-0.114,0.09300000000000001,-27.8,-21.9,-0.27899999999999997,-6.5,0.5,9.7,0.5,1.5,3.4,5.2,-8.7,1.6,13.0,4.5,"harvedo01, hilarne01, howarju01, whitero02, willish01",5,2003,DEN
M. Camby | J. Harrington | J. Howard | N. Tskitishvili | V. Yarbrough DEN 2003,33.016666666666666,13.1,9.2,11.6,0.057,-4.9,-14.8,-0.25,0.026000000000000002,-0.4,2.8,-0.111,1.4,-2.7,-9.2,-2.7,-4.1,-8.5,1.3,-3.1,-4.8,-10.0,-3.3,"cambyma01, harriju01, howarju01, tskitni01, yarbrvi01",5,2003,DEN
D. Harvey | N. Hilário | J. Howard | J. Posey | K. Satterfield DEN 2003,30.9,1.9,7.7,13.4,0.012,-2.0,-2.4,-0.107,-0.002,-11.5,-13.6,-0.282,7.0,23.9,14.0,23.9,10.2,26.8,-1.0,-5.2,-3.6,8.5,1.9,"harvedo01, hilarne01, howarju01, poseyja01, satteke01",5,2003,DEN
J. Harrington | N. Hilário | J. Howard | R. White | V. Yarbrough DEN 2003,30.683333333333334,-32.7,-20.6,-17.9,-0.159,-3.6,-3.9,-0.22899999999999998,-0.177,12.1,22.0,-0.175,2.8,5.6,1.7,5.6,1.7,3.8,-9.6,-4.6,2.1,9.5,-3.4,"harriju01, hilarne01, howarju01, whitero02, yarbrvi01",5,2003,DEN
R. Bowen | J. Harrington | N. Hilário | J. Howard | N. Tskitishvili DEN 2003,29.566666666666666,-13.2,-5.7,30.2,-0.18899999999999997,-3.8,5.7,-0.55,-0.217,1.9,1.9,0.019,20.8,19.4,-9.4,19.4,5.7,10.7,-7.5,7.5,-5.7,-7.5,0.9,"bowenry01, harriju01, hilarne01, howarju01, tskitni01",5,2003,DEN
M. Blount | D. Harvey | J. Howard | J. Posey | C. Whitney DEN 2003,29.333333333333332,15.8,11.1,24.0,0.0,-1.7,5.4,-0.35700000000000004,-0.016,-4.7,-2.8,-0.07200000000000001,7.2,9.5,-4.0,9.5,1.7,4.2,12.7,3.4,3.4,-10.1,2.6,"blounma01, harvedo01, howarju01, poseyja01, whitnch01",5,2003,DEN
C. Anthony | M. Camby | N. Hilário | V. Lenard | A. Miller DEN 2004,980.6666666666666,7.6,2.6,2.5,0.017,-1.3,-3.9,0.004,0.009000000000000001,3.6,3.4,0.046,2.0,4.0,1.0,4.0,1.5,3.6,-0.9,2.0,0.1,-1.7,-0.7,"anthoca01, cambyma01, hilarne01, lenarvo01, millean02",5,2004,DEN
C. Anthony | J. Barry | M. Camby | N. Hilário | A. Miller DEN 2004,172.0,5.6,0.5,-0.7,0.009000000000000001,-2.5,-6.7,0.063,-0.005,7.0,8.7,0.031,2.7,5.5,2.6,5.5,2.5,5.2,2.5,1.6,-0.8,0.3,-2.5,"anthoca01, barryjo01, cambyma01, hilarne01, millean02",5,2004,DEN
C. Anthony | F. Elson | N. Hilário | V. Lenard | A. Miller DEN 2004,163.51666666666668,7.4,1.5,0.0,0.019,-0.6,-1.9,0.009000000000000001,0.015,4.9,4.9,0.059000000000000004,-3.1,-6.0,-0.3,-6.0,-1.7,-4.1,0.6,1.2,-1.9,-4.0,1.1,"anthoca01, elsonfr01, hilarne01, lenarvo01, millean02",5,2004,DEN
C. Anthony | E. Boykins | M. Camby | N. Hilário | A. Miller DEN 2004,162.38333333333333,6.5,-1.6,-2.0,-0.008,-3.2,-5.2,-0.10099999999999999,-0.026000000000000002,12.8,11.2,0.151,-3.6,-6.6,-0.5,-6.6,-2.2,-5.4,-0.7,4.8,-1.4,-5.6,-4.4,"anthoca01, boykiea01, cambyma01, hilarne01, millean02",5,2004,DEN
C. Anthony | M. Camby | F. Elson | V. Lenard | A. Miller DEN 2004,87.71666666666667,-10.4,1.1,10.2,-0.033,-4.7,-2.5,-0.28,-0.061,-7.8,-10.5,-0.03,1.9,-0.6,-5.2,-0.6,-1.2,-2.4,-3.2,-1.6,-3.3,-0.5,1.5,"anthoca01, cambyma01, elsonfr01, lenarvo01, millean02",5,2004,DEN
C. Anthony | E. Boykins | N. Hilário | V. Lenard | A. Miller DEN 2004,72.66666666666667,-13.0,-3.7,4.8,-0.069,-2.1,-1.5,-0.095,-0.083,-3.6,-4.3,-0.012,-2.1,-7.6,-6.6,-7.6,-4.4,-9.2,-7.0,3.4,-9.4,-4.2,0.3,"anthoca01, boykiea01, hilarne01, lenarvo01, millean02",5,2004,DEN
C. Andersen | C. Anthony | N. Hilário | V. Lenard | A. Miller DEN 2004,70.8,29.1,6.4,-7.4,0.115,2.0,-8.6,0.264,0.13,14.2,13.4,0.11699999999999999,-5.7,-6.0,7.4,-6.0,0.7,1.6,7.3,0.1,5.0,-3.7,-1.4,"anderch01, anthoca01, hilarne01, lenarvo01, millean02",5,2004,DEN
C. Andersen | C. Anthony | M. Camby | V. Lenard | A. Miller DEN 2004,54.03333333333333,-27.8,-8.5,-4.9,-0.069,-3.6,-3.5,-0.163,-0.08800000000000001,-7.1,-9.8,0.027999999999999997,-4.4,-8.8,-3.4,-8.8,-3.7,-8.2,-6.1,-0.2,0.8,7.8,2.8,"anderch01, anthoca01, cambyma01, lenarvo01, millean02",5,2004,DEN
C. Andersen | C. Anthony | E. Boykins | N. Hilário | A. Miller DEN 2004,50.43333333333333,16.0,0.0,-2.1,0.01,2.1,-4.3,0.28600000000000003,0.022000000000000002,13.8,23.4,-0.085,4.3,3.7,-2.1,3.7,1.1,2.0,-3.2,3.2,-1.1,-6.4,-9.6,"anderch01, anthoca01, boykiea01, hilarne01, millean02",5,2004,DEN
C. Anthony | E. Boykins | M. Camby | N. Hilário | V. Lenard DEN 2004,46.666666666666664,27.3,9.7,3.9,0.094,5.0,0.2,0.319,0.122,2.9,1.5,0.054000000000000006,4.6,9.9,5.0,9.9,4.2,8.9,2.8,-1.7,-4.9,-1.9,-1.6,"anthoca01, boykiea01, cambyma01, hilarne01, lenarvo01",5,2004,DEN
C. Anthony | E. Boykins | M. Camby | V. Lenard | A. Miller DEN 2004,44.31666666666667,30.5,4.2,-7.1,0.08800000000000001,3.5,6.0,0.10300000000000001,0.11,18.5,19.9,0.153,-0.8,5.6,10.5,5.6,5.1,10.3,3.9,0.9,-0.2,-4.1,-2.8,"anthoca01, boykiea01, cambyma01, lenarvo01, millean02",5,2004,DEN
C. Andersen | J. Barry | E. Boykins | N. Hilário | R. White DEN 2004,40.61666666666667,-23.7,-14.9,-10.1,-0.124,-0.2,6.1,-0.14400000000000002,-0.122,6.2,10.0,-0.07200000000000001,-8.7,-20.2,-10.8,-20.2,-10.1,-21.7,-10.3,-2.3,1.5,0.4,-7.4,"anderch01, barryjo01, boykiea01, hilarne01, whitero02",5,2004,DEN
C. Anthony | M. Camby | N. Hilário | A. Miller | R. White DEN 2004,36.05,24.0,5.6,-9.8,0.11900000000000001,0.2,-8.7,0.233,0.124,12.6,7.7,0.302,-2.2,7.6,17.3,7.6,7.9,18.2,-1.5,1.0,-6.9,3.3,-3.3,"anthoca01, cambyma01, hilarne01, millean02, whitero02",5,2004,DEN
C. Anthony | M. Camby | V. Lenard | A. Miller | R. White DEN 2004,30.583333333333332,-27.7,-11.7,12.0,-0.163,-0.2,12.7,-0.08,-0.165,-4.2,-8.3,0.08199999999999999,6.5,0.6,-6.3,0.6,0.0,0.0,-5.9,7.7,3.0,-6.8,-1.7,"anthoca01, cambyma01, lenarvo01, millean02, whitero02",5,2004,DEN
C. Andersen | J. Barry | R. Bowen | E. Boykins | R. White DEN 2004,28.766666666666666,29.4,17.3,29.3,0.039,-1.8,-3.5,-0.086,0.025,-3.5,7.6,-0.6,15.0,15.2,-6.1,15.2,4.6,9.4,20.7,7.1,-3.9,-14.3,1.8,"anderch01, barryjo01, bowenry01, boykiea01, whitero02",5,2004,DEN
C. Anthony | J. Barry | E. Boykins | M. Camby | N. Hilário DEN 2004,27.866666666666667,-7.5,-6.9,-0.3,-0.08,0.1,6.1,-0.15,-0.08,6.3,-1.3,0.209,-5.5,-15.5,-10.3,-15.5,-7.8,-16.7,4.4,3.7,5.7,-7.4,2.9,"anthoca01, barryjo01, boykiea01, cambyma01, hilarne01",5,2004,DEN
C. Anthony | N. Hilário | V. Lenard | A. Miller | R. White DEN 2004,26.783333333333335,-15.7,-3.9,15.7,-0.136,-2.0,-5.9,-0.057,-0.153,-5.9,-15.7,0.16699999999999998,0.0,0.0,0.0,0.0,0.0,0.0,-5.9,-3.9,-2.0,3.9,5.9,"anthoca01, hilarne01, lenarvo01, millean02, whitero02",5,2004,DEN
C. Andersen | J. Barry | R. Bowen | E. Boykins | N. Tskitishvili DEN 2004,26.116666666666667,1.0,8.4,29.5,-0.013000000000000001,6.5,9.0,0.5,0.016,-22.3,-22.0,-0.524,13.8,12.5,-6.7,12.5,4.2,7.1,5.8,-0.8,1.4,-1.0,5.3,"anderch01, barryjo01, bowenry01, boykiea01, tskitni01",5,2004,DEN
C. Andersen | J. Barry | E. Boykins | F. Elson | R. White DEN 2004,26.0,-2.3,2.7,-8.6,0.069,6.3,6.5,0.225,0.11199999999999999,-14.0,-11.9,-0.179,-5.9,-0.7,9.7,-0.7,2.1,4.8,0.4,-14.7,12.2,2.6,2.1,"anderch01, barryjo01, boykiea01, elsonfr01, whitero02",5,2004,DEN
C. Andersen | J. Barry | E. Boykins | M. Doleac | R. White DEN 2004,25.6,7.8,5.1,-9.5,0.10300000000000001,3.8,3.7,0.22899999999999998,0.128,-6.2,-10.2,0.1,1.7,11.5,16.2,11.5,8.7,19.1,-10.1,-7.5,3.9,15.2,8.7,"anderch01, barryjo01, boykiea01, doleami01, whitero02",5,2004,DEN
C. Anthony | G. Buckner | M. Camby | K. Martin | A. Miller DEN 2005,402.93333333333334,2.5,2.4,-3.1,0.043,-3.9,-9.1,-0.048,0.022000000000000002,1.6,2.0,0.005,-1.4,-0.6,3.0,-0.6,0.9,1.9,3.0,1.3,1.7,1.2,-1.4,"anthoca01, buckngr01, cambyma01, martike01, millean02",5,2005,DEN
C. Anthony | M. Camby | D. Johnson | K. Martin | A. Miller DEN 2005,212.18333333333334,4.8,3.2,-4.2,0.06,-3.2,-7.6,-0.043,0.042,1.7,2.1,0.006,-2.2,-1.6,3.5,-1.6,0.8,1.9,6.7,1.0,0.4,0.2,-1.4,"anthoca01, cambyma01, johnsde03, martike01, millean02",5,2005,DEN
C. Anthony | E. Boykins | M. Camby | K. Martin | A. Miller DEN 2005,189.26666666666668,0.0,-3.2,-10.5,0.018000000000000002,-2.9,-7.8,-0.012,0.004,9.2,6.0,0.13699999999999998,-2.1,-0.1,4.6,-0.1,1.0,2.1,0.0,-0.8,1.3,2.5,-0.8,"anthoca01, boykiea01, cambyma01, martike01, millean02",5,2005,DEN
C. Anthony | E. Boykins | N. Hilário | K. Martin | A. Miller DEN 2005,96.08333333333333,-1.4,-3.2,-7.9,0.011000000000000001,-3.3,-8.2,-0.059000000000000004,-0.008,8.3,7.0,0.079,-1.3,-1.3,1.8,-1.3,0.0,0.0,-3.3,-0.8,-1.4,3.2,-5.5,"anthoca01, boykiea01, hilarne01, martike01, millean02",5,2005,DEN
C. Anthony | M. Camby | N. Hilário | D. Johnson | A. Miller DEN 2005,86.96666666666667,11.6,7.1,-3.4,0.10099999999999999,-3.6,-11.2,0.087,0.081,1.0,3.9,-0.12300000000000001,1.1,6.7,8.6,6.7,4.7,11.6,1.5,3.6,0.7,1.6,0.9,"anthoca01, cambyma01, hilarne01, johnsde03, millean02",5,2005,DEN
C. Anthony | G. Buckner | F. Elson | K. Martin | A. Miller DEN 2005,83.43333333333334,-1.9,-0.6,6.2,-0.040999999999999995,-4.3,-10.6,-0.07,-0.069,3.7,8.7,-0.096,7.5,9.6,-5.0,9.6,1.2,2.8,2.5,6.2,0.6,-3.1,-2.2,"anthoca01, buckngr01, elsonfr01, martike01, millean02",5,2005,DEN
C. Anthony | G. Buckner | N. Hilário | K. Martin | A. Miller DEN 2005,81.8,27.3,12.7,5.2,0.129,-2.4,-11.2,0.059000000000000004,0.113,4.3,7.3,-0.045,0.1,6.3,11.7,6.3,5.9,13.9,10.2,3.5,-2.4,-7.6,-1.8,"anthoca01, buckngr01, hilarne01, martike01, millean02",5,2005,DEN
C. Anthony | E. Boykins | F. Elson | K. Martin | A. Miller DEN 2005,55.45,-39.4,-19.3,-11.9,-0.159,-10.8,-19.6,-0.44,-0.215,10.1,15.1,-0.04,-2.8,-17.8,-17.0,-17.8,-9.9,-20.0,-15.5,2.9,-0.1,-2.8,-2.0,"anthoca01, boykiea01, elsonfr01, martike01, millean02",5,2005,DEN
C. Anthony | E. Boykins | M. Camby | N. Hilário | A. Miller DEN 2005,52.68333333333333,1.8,-1.2,-11.7,0.049,-6.2,-13.5,-0.20800000000000002,0.017,10.4,15.2,-0.05,-0.4,3.2,6.0,3.2,2.5,5.7,1.3,0.2,0.2,2.5,-5.5,"anthoca01, boykiea01, cambyma01, hilarne01, millean02",5,2005,DEN
C. Anthony | M. Camby | F. Elson | D. Johnson | A. Miller DEN 2005,50.233333333333334,19.5,8.6,-11.4,0.163,-2.0,-8.1,0.14400000000000002,0.156,4.3,3.3,0.08900000000000001,-6.0,-4.3,8.9,-4.3,1.5,3.5,8.5,-9.3,2.0,4.3,-2.1,"anthoca01, cambyma01, elsonfr01, johnsde03, millean02",5,2005,DEN
C. Anthony | N. Hilário | D. Johnson | K. Martin | A. Miller DEN 2005,49.2,10.9,7.8,1.5,0.085,-3.1,-6.3,-0.054000000000000006,0.066,-1.6,-4.8,0.077,1.7,9.1,10.9,9.1,6.0,14.0,4.2,-2.6,-5.8,2.5,3.5,"anthoca01, hilarne01, johnsde03, martike01, millean02",5,2005,DEN
G. Buckner | M. Camby | D. Johnson | K. Martin | A. Miller DEN 2005,46.4,-32.9,-13.5,-19.6,-0.048,-9.2,-15.8,-0.205,-0.091,3.2,11.9,-0.235,-1.8,-6.2,-5.1,-6.2,-3.0,-6.8,-15.4,-7.5,6.8,10.2,-4.2,"buckngr01, cambyma01, johnsde03, martike01, millean02",5,2005,DEN
E. Boykins | G. Buckner | N. Hilário | E. Nájera | W. Person DEN 2005,39.18333333333333,-1.3,1.5,-10.2,0.059000000000000004,2.7,-0.6,0.157,0.075,-6.9,-10.4,-0.015,-14.5,-19.6,-0.1,-19.6,-6.9,-13.3,12.2,3.6,7.3,-4.6,5.7,"boykiea01, buckngr01, hilarne01, najered01, persowe01",5,2005,DEN
C. Anthony | E. Boykins | M. Camby | A. Miller | E. Nájera DEN 2005,38.95,22.5,3.6,-12.0,0.106,-4.2,-15.8,-0.188,0.085,19.5,26.1,-0.04,-0.7,1.2,2.5,1.2,0.7,1.6,2.9,5.8,5.8,-0.5,-5.5,"anthoca01, boykiea01, cambyma01, millean02, najered01",5,2005,DEN
E. Boykins | M. Camby | K. Martin | A. Miller | B. Russell DEN 2005,38.483333333333334,31.9,10.1,11.6,0.075,5.8,8.7,0.139,0.10300000000000001,5.8,-4.3,0.304,7.2,14.3,7.2,14.3,7.2,14.3,1.4,-5.8,2.9,1.4,-5.1,"boykiea01, cambyma01, martike01, millean02, russebr01",5,2005,DEN
C. Anthony | M. Camby | D. Johnson | A. Miller | E. Nájera DEN 2005,35.35,42.5,18.9,-0.7,0.218,-4.3,-12.8,0.0,0.19399999999999998,8.9,7.7,0.081,2.4,9.0,5.9,9.0,4.5,10.7,24.1,9.8,5.6,-7.8,-1.5,"anthoca01, cambyma01, johnsde03, millean02, najered01",5,2005,DEN
C. Anthony | E. Boykins | N. Hilário | K. Martin | B. Russell DEN 2005,33.95,22.6,15.0,5.4,0.141,-0.1,1.4,-0.018000000000000002,0.14,-7.4,-4.1,-0.139,3.1,11.7,14.6,11.7,8.7,14.7,8.4,5.4,1.8,1.5,-3.5,"anthoca01, boykiea01, hilarne01, martike01, russebr01",5,2005,DEN
E. Boykins | M. Camby | N. Hilário | A. Miller | B. Russell DEN 2005,32.45,-4.3,5.5,10.7,0.018000000000000002,2.3,0.0,0.133,0.027000000000000003,-17.7,-17.5,-0.10800000000000001,-8.8,-15.7,-9.7,-15.7,-8.0,-13.8,7.8,6.8,9.8,-5.6,3.6,"boykiea01, cambyma01, hilarne01, millean02, russebr01",5,2005,DEN
