lineup,mp,diff_pts,diff_fg,diff_fga,diff_fg_pct,diff_fg3,diff_fg3a,diff_fg3_pct,diff_efg_pct,diff_ft,diff_fta,diff_ft_pct,diff_orb,diff_orb_pct,diff_drb,diff_drb_pct,diff_trb,diff_trb_pct,diff_ast,diff_stl,diff_blk,diff_tov,diff_pf,player_ids,number_players,year,team
D. Ellis | M. Jackson | E. Johnson | A. McDyess | B. Stith DEN 1997,365.98333333333335,-4.7,-1.8,-0.9,-0.016,-0.3,2.3,-0.07200000000000001,-0.017,-0.5,-1.3,0.026000000000000002,0.8,0.8,-0.6,0.8,0.1,0.3,5.3,-1.0,-0.3,2.2,1.8,"ellisda01, jacksma01, johnser02, mcdyean01, stithbr01",5,1997,DEN
L. Ellis | M. Jackson | E. Johnson | A. McDyess | B. Stith DEN 1997,196.58333333333334,3.6,-0.3,-3.4,0.013999999999999999,1.7,2.5,0.047,0.025,2.5,2.4,0.03,-0.1,2.4,3.8,2.4,2.1,4.7,4.4,-1.5,0.8,1.9,-1.2,"ellisla01, jacksma01, johnser02, mcdyean01, stithbr01",5,1997,DEN
D. Ellis | A. Goldwire | T. Hammonds | E. Johnson | A. McDyess DEN 1997,166.3,-2.2,-3.3,-10.4,0.013999999999999999,1.2,1.1,0.047,0.025,1.2,6.4,-0.18,-3.5,-4.3,1.1,-4.3,-1.2,-2.5,2.3,-5.5,-1.5,3.9,-1.2,"ellisda01, goldwan01, hammoto01, johnser02, mcdyean01",5,1997,DEN
D. Ellis | L. Ellis | M. Jackson | E. Johnson | B. Stith DEN 1997,155.11666666666667,-4.4,-5.2,-3.1,-0.043,3.3,7.1,0.040999999999999995,-0.022000000000000002,2.6,4.1,-0.036000000000000004,1.5,3.7,1.9,3.7,1.5,3.4,3.1,-2.6,-0.2,1.7,-0.3,"ellisda01, ellisla01, jacksma01, johnser02, stithbr01",5,1997,DEN
L. Ellis | A. Goldwire | E. Johnson | A. McDyess | B. Stith DEN 1997,139.2,11.4,4.9,-3.5,0.07200000000000001,1.9,0.1,0.106,0.084,-0.2,-0.2,-0.003,0.5,5.8,9.2,5.8,4.9,10.5,8.1,-4.2,0.7,6.5,-1.9,"ellisla01, goldwan01, johnser02, mcdyean01, stithbr01",5,1997,DEN
D. Ellis | L. Ellis | M. Jackson | E. Johnson | R. Pierce DEN 1997,127.48333333333333,13.5,-2.9,-16.3,0.046,5.7,4.5,0.21100000000000002,0.08199999999999999,13.5,11.4,0.18899999999999997,-11.9,-14.1,4.1,-14.1,-4.1,-8.7,2.3,-1.8,3.8,-1.9,-4.5,"ellisda01, ellisla01, jacksma01, johnser02, piercri01",5,1997,DEN
L. Ellis | M. Jackson | E. Johnson | A. McDyess | R. Pierce DEN 1997,98.61666666666666,-13.0,-2.1,-2.6,-0.009000000000000001,-4.7,-3.1,-0.28800000000000003,-0.033,-4.1,-3.1,-0.092,1.6,2.8,0.5,2.8,1.0,2.3,-5.2,-5.7,6.7,6.2,-0.8,"ellisla01, jacksma01, johnser02, mcdyean01, piercri01",5,1997,DEN
D. Ellis | T. Hammonds | M. Jackson | E. Johnson | B. Stith DEN 1997,92.15,-15.8,-11.0,-11.8,-0.07,-1.2,1.0,-0.095,-0.073,6.1,7.8,0.009000000000000001,-0.6,0.9,3.0,0.9,1.1,2.4,-2.4,-3.4,2.9,5.0,-1.1,"ellisda01, hammoto01, jacksma01, johnser02, stithbr01",5,1997,DEN
D. Ellis | T. Hammonds | M. Jackson | A. McDyess | B. Stith DEN 1997,87.56666666666666,-0.5,-8.5,-15.6,-0.019,2.9,3.7,0.106,0.004,13.5,14.2,0.10099999999999999,-2.6,-2.3,2.9,-2.3,0.3,0.6,-2.4,-5.3,-0.6,5.9,-3.1,"ellisda01, hammoto01, jacksma01, mcdyean01, stithbr01",5,1997,DEN
D. Ellis | L. Ellis | E. Johnson | A. McDyess | B. Thompson DEN 1997,84.68333333333334,-4.3,-5.6,-8.6,-0.016,2.9,15.1,-0.19,0.006,3.9,3.0,0.081,-1.8,-4.6,-2.4,-4.6,-1.5,-3.5,3.9,-5.4,7.0,5.6,2.1,"ellisda01, ellisla01, johnser02, mcdyean01, thompbr01",5,1997,DEN
D. Ellis | L. Ellis | T. Hammonds | M. Jackson | B. Stith DEN 1997,78.21666666666667,-20.9,-8.3,10.5,-0.146,0.6,12.7,-0.225,-0.147,-4.9,-5.0,-0.026000000000000002,6.3,0.4,-11.3,0.4,-2.6,-5.8,-2.3,-2.5,-1.2,-1.4,-2.9,"ellisda01, ellisla01, hammoto01, jacksma01, stithbr01",5,1997,DEN
D. Ellis | L. Ellis | E. Johnson | A. McDyess | K. Smith DEN 1997,72.91666666666667,-32.9,-19.6,-7.6,-0.192,-1.8,5.6,-0.228,-0.2,8.0,6.2,0.10099999999999999,6.1,5.1,-7.7,5.1,-0.3,-0.8,-22.3,-6.5,-3.8,11.0,-1.4,"ellisda01, ellisla01, johnser02, mcdyean01, smithke01",5,1997,DEN
D. Ellis | L. Ellis | A. Goldwire | E. Johnson | A. McDyess DEN 1997,65.85,-8.3,-5.2,0.1,-0.055999999999999994,0.7,8.1,-0.091,-0.052000000000000005,1.3,8.9,-0.294,6.7,8.4,-2.5,8.4,1.9,3.6,-0.3,-2.2,0.1,2.9,0.8,"ellisda01, ellisla01, goldwan01, johnser02, mcdyean01",5,1997,DEN
D. Ellis | T. Hammonds | E. Johnson | A. McDyess | K. Smith DEN 1997,56.4,-9.3,-6.7,-9.9,-0.026000000000000002,-0.6,2.2,-0.085,-0.024,4.7,0.6,0.2,-5.0,-10.1,-0.9,-10.1,-2.6,-6.0,-1.1,-3.7,-1.0,4.6,-1.3,"ellisda01, hammoto01, johnser02, mcdyean01, smithke01",5,1997,DEN
D. Ellis | T. Hammonds | A. McDyess | B. Stith | B. Thompson DEN 1997,55.61666666666667,-9.7,-9.7,-9.3,-0.063,6.1,8.4,0.151,-0.019,3.6,-5.0,0.204,-5.9,-10.3,1.0,-10.3,-2.8,-7.1,0.1,-4.3,-7.1,4.0,2.8,"ellisda01, hammoto01, mcdyean01, stithbr01, thompbr01",5,1997,DEN
L. Ellis | D. Ham | M. Jackson | E. Johnson | B. Stith DEN 1997,47.4,-1.0,-4.7,-10.3,0.006999999999999999,4.2,16.9,-0.405,0.035,4.0,1.5,0.217,1.6,5.7,4.7,5.7,2.4,5.7,-1.0,-9.0,0.6,12.4,-2.4,"ellisla01, hamda01, jacksma01, johnser02, stithbr01",5,1997,DEN
D. Ellis | L. Ellis | M. Jackson | A. McDyess | B. Stith DEN 1997,41.38333333333333,7.3,1.4,7.2,-0.019,3.6,6.8,0.111,0.0,0.8,9.6,-0.21899999999999997,4.0,1.5,-4.4,1.5,-0.7,-1.3,11.5,0.6,2.9,-10.1,-5.2,"ellisda01, ellisla01, jacksma01, mcdyean01, stithbr01",5,1997,DEN
D. Ellis | T. Hammonds | M. Jackson | E. Johnson | B. Thompson DEN 1997,38.06666666666667,11.2,4.5,6.8,0.018000000000000002,3.1,9.4,-0.011000000000000001,0.032,-0.8,0.9,-0.067,3.5,0.0,-7.0,0.0,-1.4,-3.0,16.7,5.3,-1.6,-3.7,0.7,"ellisda01, hammoto01, jacksma01, johnser02, thompbr01",5,1997,DEN
D. Ellis | E. Johnson | A. McDyess | K. Smith | B. Thompson DEN 1997,35.733333333333334,-23.6,-14.1,-7.4,-0.109,1.6,16.6,-0.237,-0.098,3.1,-1.3,0.375,1.7,-2.2,-6.4,-2.2,-2.2,-4.5,-4.1,-6.1,-4.5,10.6,0.0,"ellisda01, johnser02, mcdyean01, smithke01, thompbr01",5,1997,DEN
D. Ellis | L. Ellis | T. Hammonds | M. Jackson | R. Pierce DEN 1997,34.7,4.6,-3.5,4.0,-0.069,9.9,14.3,0.135,-0.012,1.7,0.4,0.05,-1.3,-11.1,-13.0,-11.1,-7.0,-18.5,8.7,4.1,-7.0,-6.8,2.1,"ellisda01, ellisla01, hammoto01, jacksma01, piercri01",5,1997,DEN
T. Battie | L. Ellis | D. Garrett | B. Jackson | E. Washington DEN 1998,365.1166666666667,-10.4,-1.8,0.3,-0.021,-4.4,-6.8,-0.14,-0.044000000000000004,-4.2,-6.0,0.012,0.4,0.4,-0.2,0.4,0.1,0.1,-3.8,0.0,-0.3,2.2,2.9,"battito01, ellisla01, garrede01, jacksbo01, washier01",5,1998,DEN
C. Alexander | L. Ellis | D. Fortson | D. Garrett | A. Goldwire DEN 1998,249.46666666666667,-5.0,-3.0,2.1,-0.043,1.3,1.6,0.055,-0.037000000000000005,-0.3,-2.5,0.07400000000000001,0.3,0.7,0.4,0.7,0.4,0.9,-5.7,1.7,-2.7,-0.6,0.9,"alexaco01, ellisla01, fortsda01, garrede01, goldwan01",5,1998,DEN
C. Alexander | L. Ellis | D. Garrett | A. Goldwire | J. Newman DEN 1998,117.31666666666666,10.4,-2.8,-8.7,0.017,5.1,3.8,0.19,0.053,11.0,14.4,0.002,-7.1,-11.5,2.8,-11.5,-2.5,-6.4,-4.0,3.3,0.3,-4.8,-4.8,"alexaco01, ellisla01, garrede01, goldwan01, newmajo01",5,1998,DEN
T. Battie | L. Ellis | D. Garrett | B. Jackson | J. Newman DEN 1998,108.2,-17.0,-4.5,1.1,-0.055999999999999994,-4.7,-3.7,-0.27399999999999997,-0.08199999999999999,-3.3,-7.0,0.08199999999999999,-0.2,-4.7,-5.9,-4.7,-3.1,-6.3,-5.9,0.6,-0.4,0.9,1.8,"battito01, ellisla01, garrede01, jacksbo01, newmajo01",5,1998,DEN
L. Ellis | D. Fortson | D. Garrett | B. Jackson | E. Washington DEN 1998,91.33333333333333,-29.3,-12.7,-10.8,-0.09300000000000001,0.0,-1.6,0.054000000000000006,-0.08800000000000001,-3.8,-1.0,-0.113,1.8,6.3,4.3,6.3,3.1,7.7,-8.3,-5.7,-0.6,11.4,3.9,"ellisla01, fortsda01, garrede01, jacksbo01, washier01",5,1998,DEN
L. Ellis | D. Garrett | A. Goldwire | B. Jackson | J. Newman DEN 1998,85.81666666666666,-10.0,-7.4,-10.4,-0.035,-0.8,-6.0,0.11,-0.035,5.6,7.7,-0.013999999999999999,-3.0,-2.8,2.3,-2.8,-0.6,-1.4,6.0,-2.7,3.3,2.0,-5.8,"ellisla01, garrede01, goldwan01, jacksbo01, newmajo01",5,1998,DEN
L. Ellis | D. Fortson | D. Garrett | A. Goldwire | J. Newman DEN 1998,80.46666666666667,-20.0,-8.5,-3.1,-0.08900000000000001,-3.4,-4.8,-0.12300000000000001,-0.109,0.3,-2.5,0.064,-0.8,-5.5,-6.9,-5.5,-4.0,-8.5,-5.6,-0.6,-2.6,4.4,0.3,"ellisla01, fortsda01, garrede01, goldwan01, newmajo01",5,1998,DEN
T. Battie | L. Ellis | D. Garrett | A. Goldwire | J. Newman DEN 1998,74.35,-32.1,-8.1,-0.1,-0.08900000000000001,-2.0,-6.1,0.0,-0.1,-16.6,-22.1,0.006999999999999999,-7.6,-15.2,-9.3,-15.2,-8.4,-15.8,-8.2,-2.8,-1.4,2.2,3.5,"battito01, ellisla01, garrede01, goldwan01, newmajo01",5,1998,DEN
T. Battie | L. Ellis | D. Garrett | A. Goldwire | B. Stith DEN 1998,64.53333333333333,-41.1,-13.7,3.1,-0.165,-3.2,-2.7,-0.131,-0.183,-10.5,-16.4,0.124,5.0,-1.7,-11.7,-1.7,-3.0,-6.5,-13.6,-6.4,-0.1,8.4,0.0,"battito01, ellisla01, garrede01, goldwan01, stithbr01",5,1998,DEN
T. Battie | D. Garrett | B. Jackson | J. Newman | B. Stith DEN 1998,63.7,0.6,-1.5,-8.6,0.026000000000000002,-1.6,-3.1,-0.182,0.017,2.0,1.3,0.055999999999999994,-2.9,-1.3,4.1,-1.3,0.8,1.7,-8.5,-3.6,-2.6,5.5,-1.2,"battito01, garrede01, jacksbo01, newmajo01, stithbr01",5,1998,DEN
T. Battie | L. Ellis | D. Garrett | A. Goldwire | B. Jackson DEN 1998,62.31666666666667,-18.6,-1.5,10.5,-0.08,-5.3,-3.3,-0.35200000000000004,-0.114,-10.3,-12.8,-0.040999999999999995,-1.4,-12.6,-9.7,-12.6,-5.4,-14.6,-5.4,4.2,0.7,-6.8,4.5,"battito01, ellisla01, garrede01, goldwan01, jacksbo01",5,1998,DEN
C. Alexander | L. Ellis | D. Fortson | A. Goldwire | J. Newman DEN 1998,54.88333333333333,-14.0,1.2,9.7,-0.05,1.7,4.3,-0.008,-0.044000000000000004,-18.0,-14.5,-0.163,-1.0,-10.0,-11.4,-10.0,-6.4,-19.4,-9.5,4.8,-1.8,-4.0,4.6,"alexaco01, ellisla01, fortsda01, goldwan01, newmajo01",5,1998,DEN
L. Ellis | D. Fortson | D. Garrett | B. Jackson | J. Newman DEN 1998,54.21666666666667,-36.4,-18.7,-0.9,-0.218,-7.5,-10.3,-0.318,-0.263,8.4,17.8,-0.126,6.5,1.6,-10.3,1.6,-1.9,-4.5,-13.1,5.6,-3.7,-0.9,-6.5,"ellisla01, fortsda01, garrede01, jacksbo01, newmajo01",5,1998,DEN
D. Fortson | D. Garrett | A. Goldwire | J. Newman | E. Washington DEN 1998,51.983333333333334,-36.0,-14.4,-11.8,-0.109,-3.1,-9.4,-0.057999999999999996,-0.126,-4.0,-9.2,0.046,-5.1,-14.4,-8.8,-14.4,-6.9,-15.3,-14.6,-8.6,-2.2,9.7,5.3,"fortsda01, garrede01, goldwan01, newmajo01, washier01",5,1998,DEN
L. Ellis | D. Garrett | B. Jackson | E. Washington | J. Wolf DEN 1998,51.21666666666667,-21.6,-5.5,4.2,-0.076,-4.3,-6.4,-0.083,-0.099,-6.4,-7.6,-0.147,11.9,21.0,6.3,21.0,8.7,17.5,-13.3,-9.1,-1.9,11.0,0.5,"ellisla01, garrede01, jacksbo01, washier01, wolfjo01",5,1998,DEN
D. Fortson | D. Garrett | B. Jackson | J. Newman | E. Washington DEN 1998,48.68333333333333,10.0,0.6,2.2,-0.006,1.0,-10.3,0.345,-0.001,7.9,12.9,-0.076,6.0,15.8,6.4,15.8,6.1,15.8,-11.4,7.2,-5.0,-2.2,0.5,"fortsda01, garrede01, jacksbo01, newmajo01, washier01",5,1998,DEN
D. Fortson | D. Garrett | A. Goldwire | B. Jackson | J. Newman DEN 1998,48.5,-23.0,-5.5,8.0,-0.115,-2.0,-0.8,-0.141,-0.129,-10.0,-7.7,-0.127,4.4,1.7,-10.1,1.7,-2.6,-6.5,-4.8,-0.2,-5.4,-0.8,3.2,"fortsda01, garrede01, goldwan01, jacksbo01, newmajo01",5,1998,DEN
L. Ellis | D. Garrett | B. Jackson | J. Newman | E. Washington DEN 1998,48.31666666666667,-39.6,-17.3,-4.7,-0.185,-4.9,7.7,-0.49200000000000005,-0.213,-0.2,-8.1,0.161,-2.7,-10.0,-7.0,-10.0,-4.6,-11.4,-13.6,-4.4,-2.3,2.5,4.6,"ellisla01, garrede01, jacksbo01, newmajo01, washier01",5,1998,DEN
T. Battie | D. Garrett | B. Jackson | B. Stith | E. Williams DEN 1998,44.016666666666666,5.5,4.7,19.7,-0.059000000000000004,-3.5,-3.6,-0.3,-0.084,-0.5,-1.7,0.036000000000000004,11.1,20.7,-1.6,20.7,4.5,11.8,-6.2,3.6,-4.3,-7.2,-3.4,"battito01, garrede01, jacksbo01, stithbr01, willier01",5,1998,DEN
T. Battie | L. Ellis | D. Garrett | A. Goldwire | E. Washington DEN 1998,42.4,-38.8,-13.5,-1.1,-0.147,-2.9,2.4,-0.349,-0.163,-9.0,-14.6,0.083,5.0,-0.2,-7.5,-0.2,-1.4,-3.1,-17.2,-8.0,0.1,11.9,1.4,"battito01, ellisla01, garrede01, goldwan01, washier01",5,1998,DEN
C. Billups | D. Fortson | A. McDyess | B. Stith | N. Van Exel DEN 1999,369.3333333333333,-14.3,-9.0,-4.8,-0.073,0.3,6.2,-0.147,-0.07,3.5,3.3,0.049,-1.5,-3.9,-2.1,-3.9,-1.8,-4.2,-9.9,-0.7,-0.8,1.3,-0.4,"billuch01, fortsda01, mcdyean01, stithbr01, vanexni01",5,1999,DEN
C. Billups | D. Fortson | A. McDyess | J. Taylor | N. Van Exel DEN 1999,152.31666666666666,0.1,-1.1,-1.4,-0.005,1.1,5.5,-0.08199999999999999,0.002,1.1,3.5,-0.07400000000000001,3.5,8.1,4.5,8.1,4.1,8.7,-2.2,-1.7,-1.7,2.8,1.7,"billuch01, fortsda01, mcdyean01, taylojo01, vanexni01",5,1999,DEN
C. Billups | R. LaFrentz | A. McDyess | B. Stith | N. Van Exel DEN 1999,94.25,-7.6,-6.0,-2.1,-0.057,4.1,16.6,-0.228,-0.032,-0.8,2.2,-0.08900000000000001,1.0,-3.5,-7.1,-3.5,-2.7,-6.7,-9.3,-2.5,1.4,1.0,0.3,"billuch01, lafrera01, mcdyean01, stithbr01, vanexni01",5,1999,DEN
C. Alexander | D. Fortson | A. McDyess | N. Van Exel | E. Williams DEN 1999,90.08333333333333,-10.6,-5.8,-6.1,-0.038,-5.1,-7.4,-0.17300000000000001,-0.065,6.1,8.3,0.027000000000000003,-0.7,1.1,3.0,1.1,1.1,2.2,-7.4,-2.7,-3.9,2.1,-1.1,"alexaco01, fortsda01, mcdyean01, vanexni01, willier01",5,1999,DEN
C. Billups | D. Fortson | A. McDyess | N. Van Exel | E. Williams DEN 1999,55.983333333333334,-5.2,-2.3,6.7,-0.064,-0.2,1.3,-0.055999999999999994,-0.067,-0.4,-4.9,0.08800000000000001,10.8,14.9,-1.1,14.9,4.4,9.3,0.6,-2.4,-0.6,4.0,3.9,"billuch01, fortsda01, mcdyean01, vanexni01, willier01",5,1999,DEN
C. Billups | D. Fortson | A. McDyess | N. Van Exel | E. Washington DEN 1999,50.7,-2.6,0.3,4.0,-0.016,-1.8,-0.2,-0.066,-0.027000000000000003,-1.5,-5.4,0.10400000000000001,4.7,9.2,4.2,9.2,4.7,9.5,0.6,-1.2,-5.4,3.5,4.7,"billuch01, fortsda01, mcdyean01, vanexni01, washier01",5,1999,DEN
D. Fortson | A. McDyess | B. Stith | N. Van Exel | E. Washington DEN 1999,44.333333333333336,-16.8,-4.2,0.7,-0.05,-5.6,-3.7,-0.213,-0.081,-2.8,-3.7,0.0,1.9,-6.5,-12.1,-6.5,-4.8,-10.8,1.2,-2.7,1.0,2.0,2.4,"fortsda01, mcdyean01, stithbr01, vanexni01, washier01",5,1999,DEN
D. Fortson | A. McDyess | J. Taylor | N. Van Exel | E. Washington DEN 1999,40.166666666666664,-0.8,-1.9,3.0,-0.031,1.1,-6.0,0.25,-0.026000000000000002,1.8,-2.7,0.14300000000000002,7.2,9.5,-0.5,9.5,2.7,4.9,0.2,-5.0,-6.3,7.5,-3.3,"fortsda01, mcdyean01, taylojo01, vanexni01, washier01",5,1999,DEN
C. Billups | R. LaFrentz | A. McDyess | N. Van Exel | E. Washington DEN 1999,39.61666666666667,10.3,0.0,-10.3,0.049,12.8,24.4,0.282,0.126,-2.6,-6.4,0.08,-12.8,-19.0,1.3,-19.0,-5.8,-12.7,0.0,3.8,3.8,-2.6,1.9,"billuch01, lafrera01, mcdyean01, vanexni01, washier01",5,1999,DEN
R. LaFrentz | A. McDyess | B. Stith | N. Van Exel | E. Williams DEN 1999,37.55,-27.3,-14.4,5.4,-0.16899999999999998,-1.3,2.9,-0.175,-0.17600000000000002,2.9,4.3,-0.031,5.7,3.3,-7.3,3.3,-0.7,-1.2,-14.6,5.3,-1.4,-2.6,2.0,"lafrera01, mcdyean01, stithbr01, vanexni01, willier01",5,1999,DEN
C. Alexander | D. Fortson | A. McDyess | N. Van Exel | E. Washington DEN 1999,28.95,9.5,1.1,3.9,-0.005,1.7,13.2,-0.28600000000000003,0.001,5.5,5.4,0.046,3.5,3.7,-1.2,3.7,1.0,1.8,11.2,4.0,-1.9,-2.1,1.9,"alexaco01, fortsda01, mcdyean01, vanexni01, washier01",5,1999,DEN
C. Alexander | D. Fortson | A. McDyess | B. Stith | N. Van Exel DEN 1999,28.766666666666666,-5.1,4.8,12.3,-0.006,4.2,14.1,-0.071,0.011000000000000001,-18.9,-18.8,-0.183,3.1,-0.1,-6.0,-0.1,-0.9,-1.8,0.0,-0.7,3.4,-4.3,6.4,"alexaco01, fortsda01, mcdyean01, stithbr01, vanexni01",5,1999,DEN
C. Billups | A. McDyess | J. Taylor | E. Washington | E. Williams DEN 1999,28.366666666666667,-29.5,-14.0,-19.9,-0.065,-3.3,-0.4,-0.16399999999999998,-0.077,1.8,2.1,0.0,-8.5,-16.0,1.8,-16.0,-2.8,-7.7,-7.7,-6.0,5.2,10.4,2.8,"billuch01, mcdyean01, taylojo01, washier01, willier01",5,1999,DEN
C. Billups | C. Herrera | A. McDyess | J. Taylor | E. Washington DEN 1999,26.316666666666666,0.0,-4.1,12.2,-0.10300000000000001,0.0,6.1,-0.043,-0.105,8.2,14.3,-0.069,8.2,7.2,-6.1,7.2,1.0,1.9,0.0,10.2,-4.1,-10.2,4.1,"billuch01, herreca01, mcdyean01, taylojo01, washier01",5,1999,DEN
C. Alexander | K. Clark | A. McDyess | N. Van Exel | E. Williams DEN 1999,25.916666666666668,6.9,6.7,2.6,0.063,2.4,5.9,0.079,0.076,-8.9,-8.7,-0.032,-8.2,-22.7,-13.5,-22.7,-10.0,-22.7,-5.4,4.9,3.3,-8.2,3.0,"alexaco01, clarkke01, mcdyean01, vanexni01, willier01",5,1999,DEN
C. Alexander | C. Billups | D. Fortson | A. McDyess | B. Stith DEN 1999,25.166666666666668,6.4,0.8,1.6,0.0,6.3,16.8,0.03,0.039,-1.4,0.7,-0.059000000000000004,2.3,5.6,1.5,5.6,2.1,5.6,2.6,-6.5,10.2,2.5,2.1,"alexaco01, billuch01, fortsda01, mcdyean01, stithbr01",5,1999,DEN
C. Alexander | C. Billups | R. LaFrentz | A. McDyess | B. Stith DEN 1999,24.683333333333334,20.0,18.5,26.2,0.08900000000000001,7.9,21.6,0.024,0.128,-24.8,-31.4,0.031,-6.9,-16.2,-2.7,-16.2,-5.2,-15.2,12.7,6.6,0.5,-15.4,6.2,"alexaco01, billuch01, lafrera01, mcdyean01, stithbr01",5,1999,DEN
D. Fortson | A. McDyess | B. Stith | N. Van Exel | E. Williams DEN 1999,24.483333333333334,-30.5,-18.3,-9.8,-0.16,2.7,10.3,-0.067,-0.141,3.3,-7.5,0.316,-6.0,-11.4,-4.9,-11.4,-4.6,-9.1,-19.2,-2.7,-3.2,7.6,9.2,"fortsda01, mcdyean01, stithbr01, vanexni01, willier01",5,1999,DEN
A. McDyess | J. Taylor | N. Van Exel | E. Washington | E. Williams DEN 1999,23.683333333333334,2.4,-0.8,8.1,-0.051,2.8,1.2,0.16699999999999998,-0.038,1.2,-0.3,0.067,5.6,3.9,-10.0,3.9,-1.1,-2.4,-7.0,1.8,2.0,-1.1,-2.3,"mcdyean01, taylojo01, vanexni01, washier01, willier01",5,1999,DEN
C. Herrera | A. McDyess | J. Taylor | N. Van Exel | E. Washington DEN 1999,22.183333333333334,14.5,4.6,-1.5,0.06,4.4,6.0,0.111,0.087,0.9,0.5,0.018000000000000002,-3.3,-3.8,2.9,-3.8,-1.2,-2.4,5.9,2.9,-2.0,-1.1,2.5,"herreca01, mcdyean01, taylojo01, vanexni01, washier01",5,1999,DEN
R. LaFrentz | A. McDyess | R. Mercer | J. Posey | N. Van Exel DEN 2000,448.0,-15.3,-7.9,-7.9,-0.046,-1.2,-0.2,-0.08199999999999999,-0.05,1.7,5.1,-0.094,-2.1,-5.3,-3.2,-5.3,-2.7,-6.0,-6.7,-2.1,1.8,2.9,-0.7,"lafrera01, mcdyean01, mercero01, poseyja01, vanexni01",5,2000,DEN
R. LaFrentz | G. McCloud | A. McDyess | J. Posey | N. Van Exel DEN 2000,194.71666666666667,2.6,0.1,-1.3,0.009000000000000001,6.3,10.5,0.113,0.045,-4.0,-4.3,-0.024,-0.7,-0.6,1.2,-0.6,0.0,0.0,1.3,-1.4,2.4,1.6,1.4,"lafrera01, mccloge01, mcdyean01, poseyja01, vanexni01",5,2000,DEN
K. Clark | R. LaFrentz | A. McDyess | J. Posey | N. Van Exel DEN 2000,178.4,-4.4,1.7,-4.4,0.040999999999999995,0.8,2.4,-0.006999999999999999,0.048,-8.7,-9.9,-0.045,-0.4,1.1,3.3,1.1,2.0,4.3,0.9,-4.5,1.8,8.2,4.0,"clarkke01, lafrera01, mcdyean01, poseyja01, vanexni01",5,2000,DEN
R. LaFrentz | G. McCloud | A. McDyess | R. Mercer | N. Van Exel DEN 2000,147.81666666666666,3.7,-0.5,-7.4,0.032,2.0,3.7,0.032,0.047,2.8,3.1,0.015,-3.6,-8.5,-4.1,-8.5,-3.9,-8.6,-1.9,-2.0,7.7,2.1,1.2,"lafrera01, mccloge01, mcdyean01, mercero01, vanexni01",5,2000,DEN
K. Clark | G. McCloud | A. McDyess | R. Mercer | N. Van Exel DEN 2000,93.3,2.2,2.5,-5.4,0.055,-0.3,1.3,-0.05,0.055,-2.5,2.3,-0.16699999999999998,-0.5,0.3,1.4,0.3,0.8,1.8,4.1,1.4,0.9,3.3,-3.4,"clarkke01, mccloge01, mcdyean01, mercero01, vanexni01",5,2000,DEN
R. LaFrentz | A. McDyess | J. Posey | B. Stith | N. Van Exel DEN 2000,85.91666666666667,22.9,5.8,5.7,0.034,9.0,11.6,0.19,0.081,2.2,3.1,0.002,5.4,11.2,3.1,11.2,3.8,8.7,7.1,1.4,-2.2,-2.2,-3.5,"lafrera01, mcdyean01, poseyja01, stithbr01, vanexni01",5,2000,DEN
T. Abdul-Wahad | R. LaFrentz | A. McDyess | J. Posey | N. Van Exel DEN 2000,85.86666666666666,-7.0,-2.1,2.5,-0.034,0.5,0.3,0.046,-0.031,-3.2,0.2,-0.20199999999999999,3.2,1.7,-5.1,1.7,-1.2,-2.4,-2.4,-0.5,1.4,0.9,3.2,"abdulta01, lafrera01, mcdyean01, poseyja01, vanexni01",5,2000,DEN
K. Clark | A. McDyess | R. Mercer | J. Posey | N. Van Exel DEN 2000,78.81666666666666,15.3,5.2,-0.5,0.062,-1.3,-5.9,0.067,0.054000000000000006,6.2,15.6,-0.16399999999999998,7.4,15.3,7.4,15.3,7.3,15.0,1.6,-3.1,3.3,0.4,-4.5,"clarkke01, mcdyean01, mercero01, poseyja01, vanexni01",5,2000,DEN
C. Billups | R. LaFrentz | A. McDyess | J. Posey | N. Van Exel DEN 2000,67.1,-17.6,-6.6,0.7,-0.075,-0.7,11.0,-0.28300000000000003,-0.079,-3.7,-5.1,0.0,-4.4,-12.9,-15.4,-12.9,-9.9,-18.9,-3.7,1.5,0.7,-2.2,-1.1,"billuch01, lafrera01, mcdyean01, poseyja01, vanexni01",5,2000,DEN
K. Clark | R. LaFrentz | G. McCloud | R. Mercer | N. Van Exel DEN 2000,58.81666666666667,7.8,3.2,7.5,-0.001,2.6,2.8,0.111,0.011000000000000001,-1.3,-8.0,0.17300000000000001,1.1,2.1,1.1,2.1,1.3,2.5,-1.3,4.2,14.2,-3.2,3.0,"clarkke01, lafrera01, mccloge01, mercero01, vanexni01",5,2000,DEN
K. Clark | G. McCloud | A. McDyess | J. Posey | N. Van Exel DEN 2000,58.28333333333333,3.0,-3.5,-7.1,-0.002,0.6,7.9,-0.129,0.006,9.3,7.4,0.08900000000000001,-4.5,-6.7,2.4,-6.7,-1.3,-3.2,2.7,1.1,5.2,-0.3,-3.4,"clarkke01, mccloge01, mcdyean01, poseyja01, vanexni01",5,2000,DEN
K. Clark | C. Gatling | A. McDyess | J. Posey | N. Van Exel DEN 2000,52.53333333333333,-6.5,-3.2,4.8,-0.059000000000000004,0.0,-7.7,0.133,-0.06,-0.1,1.7,-0.049,4.6,4.6,-5.3,4.6,-0.5,-1.0,-7.7,1.0,-4.6,-1.1,-7.5,"clarkke01, gatlich01, mcdyean01, poseyja01, vanexni01",5,2000,DEN
R. LaFrentz | G. McCloud | A. McDyess | B. Stith | N. Van Exel DEN 2000,41.36666666666667,20.2,-1.5,-11.6,0.035,2.8,7.1,0.026000000000000002,0.055,20.4,28.0,-0.002,1.4,6.2,7.8,6.2,3.1,5.7,7.8,-0.5,-2.7,-2.6,-3.1,"lafrera01, mccloge01, mcdyean01, stithbr01, vanexni01",5,2000,DEN
K. Clark | G. McCloud | A. McDyess | B. Stith | N. Van Exel DEN 2000,40.266666666666666,-6.1,-7.3,0.0,-0.08199999999999999,0.0,3.7,-0.044000000000000004,-0.08199999999999999,8.5,12.2,-0.1,4.9,5.6,-4.9,5.6,0.0,0.0,0.0,0.0,3.7,-1.2,-3.0,"clarkke01, mccloge01, mcdyean01, stithbr01, vanexni01",5,2000,DEN
K. Clark | R. LaFrentz | G. McCloud | A. McDyess | N. Van Exel DEN 2000,40.166666666666664,-8.5,-4.6,-17.0,0.028999999999999998,-1.4,1.0,-0.18100000000000002,0.027999999999999997,2.0,-12.1,0.276,-11.5,-14.5,7.2,-14.5,-2.5,-4.9,-8.0,-8.5,-1.0,10.9,0.0,"clarkke01, lafrera01, mccloge01, mcdyean01, vanexni01",5,2000,DEN
K. Clark | C. Gatling | G. McCloud | A. McDyess | N. Van Exel DEN 2000,37.483333333333334,-11.6,3.2,10.9,-0.022000000000000002,-2.4,7.1,-0.22899999999999998,-0.039,-15.6,-13.7,-0.22899999999999998,12.6,19.0,2.2,19.0,7.8,16.9,-8.1,-4.8,6.7,2.3,5.0,"clarkke01, gatlich01, mccloge01, mcdyean01, vanexni01",5,2000,DEN
T. Abdul-Wahad | R. LaFrentz | G. McCloud | A. McDyess | N. Van Exel DEN 2000,36.18333333333333,-27.8,-7.0,-6.2,-0.046,-8.9,-4.2,-0.348,-0.092,-4.9,-5.1,-0.083,-0.7,-1.6,-0.6,-1.6,-1.4,-3.3,-0.9,-7.8,1.9,10.2,-1.4,"abdulta01, lafrera01, mccloge01, mcdyean01, vanexni01",5,2000,DEN
C. Gatling | R. LaFrentz | G. McCloud | J. Posey | N. Van Exel DEN 2000,33.61666666666667,33.6,24.3,20.8,0.195,8.6,23.7,-0.212,0.23,-23.6,-24.4,-0.155,3.4,7.9,4.8,7.9,3.2,6.7,14.1,7.1,10.8,-7.7,5.6,"gatlich01, lafrera01, mccloge01, poseyja01, vanexni01",5,2000,DEN
R. Bowen | R. LaFrentz | G. McCloud | A. McDyess | N. Van Exel DEN 2000,31.85,14.8,8.3,23.4,-0.022000000000000002,3.4,10.2,0.022000000000000002,-0.01,-5.2,-1.8,-0.13,7.2,1.1,-11.0,1.1,-1.6,-3.0,6.0,10.7,4.3,-15.2,-5.5,"bowenry01, lafrera01, mccloge01, mcdyean01, vanexni01",5,2000,DEN
K. Clark | R. LaFrentz | G. McCloud | B. Stith | N. Van Exel DEN 2000,30.35,4.8,6.7,-11.2,0.147,-5.7,-4.8,-0.159,0.12,-2.8,-3.3,-0.02,-5.6,-5.7,12.3,-5.7,2.6,6.1,-6.4,-6.6,7.2,8.1,2.6,"clarkke01, lafrera01, mccloge01, stithbr01, vanexni01",5,2000,DEN
R. LaFrentz | V. Lenard | A. McDyess | J. Posey | N. Van Exel DEN 2001,841.85,3.1,-1.4,-2.0,-0.006,2.7,8.3,-0.026000000000000002,0.01,3.2,2.6,0.057,1.3,2.8,1.6,2.8,1.4,2.9,0.9,-0.7,0.9,1.9,-0.5,"lafrera01, lenarvo01, mcdyean01, poseyja01, vanexni01",5,2001,DEN
R. LaFrentz | V. Lenard | G. McCloud | A. McDyess | N. Van Exel DEN 2001,184.06666666666666,9.0,6.5,-1.1,0.083,2.3,3.5,0.055,0.09699999999999999,-6.3,-2.9,-0.122,-1.5,-2.3,0.7,-2.3,-0.5,-1.2,6.1,-1.0,-0.5,-0.2,0.5,"lafrera01, lenarvo01, mccloge01, mcdyean01, vanexni01",5,2001,DEN
T. Abdul-Wahad | R. LaFrentz | A. McDyess | J. Posey | N. Van Exel DEN 2001,110.78333333333333,-14.4,-5.0,-9.0,-0.008,-0.9,-1.2,-0.027999999999999997,-0.01,-3.6,0.3,-0.18600000000000003,-5.4,-11.4,-4.7,-11.4,-4.9,-10.7,-3.8,-3.9,1.3,2.6,0.2,"abdulta01, lafrera01, mcdyean01, poseyja01, vanexni01",5,2001,DEN
R. LaFrentz | G. McCloud | R. Pack | J. Posey | K. Willis DEN 2001,94.86666666666666,-9.2,-7.0,-8.0,-0.038,2.5,4.4,0.022000000000000002,-0.021,2.4,1.9,0.06,-0.2,1.1,2.4,1.1,1.0,1.9,-4.8,-0.9,1.1,6.4,-1.0,"lafrera01, mccloge01, packro01, poseyja01, willike02",5,2001,DEN
K. Clark | V. Lenard | A. McDyess | J. Posey | N. Van Exel DEN 2001,90.81666666666666,0.6,5.5,3.8,0.042,-0.4,0.5,-0.027999999999999997,0.038,-9.9,-9.2,-0.166,3.1,5.8,1.4,5.8,2.6,5.5,-1.7,-0.2,0.3,0.9,-0.9,"clarkke01, lenarvo01, mcdyean01, poseyja01, vanexni01",5,2001,DEN
V. Lenard | A. McDyess | J. Posey | N. Van Exel | K. Willis DEN 2001,81.73333333333333,-17.4,-10.6,-16.3,-0.043,0.4,9.5,-0.135,-0.034,3.4,5.2,-0.019,-8.9,-13.3,-1.8,-13.3,-5.9,-11.1,-12.3,-0.4,3.0,2.9,-2.8,"lenarvo01, mcdyean01, poseyja01, vanexni01, willike02",5,2001,DEN
R. LaFrentz | G. McCloud | A. McDyess | J. Posey | N. Van Exel DEN 2001,81.08333333333333,-0.3,0.3,-1.5,0.012,3.6,10.3,-0.005,0.035,-4.6,-2.3,-0.076,-2.9,-5.3,-1.1,-5.3,-2.3,-5.0,5.8,-0.5,2.7,0.9,2.3,"lafrera01, mccloge01, mcdyean01, poseyja01, vanexni01",5,2001,DEN
V. Lenard | G. McCloud | A. McDyess | N. Van Exel | K. Willis DEN 2001,80.36666666666666,-9.4,-11.0,-0.5,-0.122,-0.9,2.9,-0.105,-0.127,13.6,7.5,0.22899999999999998,1.2,-1.9,-6.0,-1.9,-2.0,-4.5,-7.1,0.4,-0.8,-0.9,-0.7,"lenarvo01, mccloge01, mcdyean01, vanexni01, willike02",5,2001,DEN
K. Clark | V. Lenard | G. McCloud | A. McDyess | N. Van Exel DEN 2001,61.266666666666666,-6.2,0.4,-1.2,0.009000000000000001,2.1,3.5,0.040999999999999995,0.021,-9.1,-6.0,-0.13699999999999998,-10.3,-21.3,-12.1,-21.3,-10.8,-21.0,2.3,4.0,3.9,-7.2,-0.9,"clarkke01, lenarvo01, mccloge01, mcdyean01, vanexni01",5,2001,DEN
